{
  "scenario_id": "eff-r1-102",
  "fidelity": "L0",
  "adapter": "simulation",
  "ideal_path": [
    {
      "n": 0,
      "actor": "orchestrator",
      "action": "resolve-subject"
    },
    {
      "n": 1,
      "actor": "orchestrator",
      "action": "single-status"
    },
    {
      "n": 2,
      "actor": "orchestrator",
      "action": "answer"
    }
  ],
  "actual_path": [
    {
      "n": 0,
      "actor": "orchestrator",
      "action": "route",
      "output_shape": "plan"
    },
    {
      "n": 1,
      "actor": "reader",
      "action": "tool_call",
      "output_shape": "rows"
    },
    {
      "n": 2,
      "actor": "reader",
      "action": "tool_call",
      "output_shape": "rows"
    },
    {
      "n": 3,
      "actor": "reader",
      "action": "tool_call",
      "output_shape": "rows"
    },
    {
      "n": 4,
      "actor": "reader",
      "action": "tool_call",
      "output_shape": "rows"
    },
    {
      "n": 5,
      "actor": "reader",
      "action": "tool_call",
      "output_shape": "rows"
    }
  ],
  "final_answer": "Predicted answer for eff-r1-102",
  "divergence": {
    "summary": "clean",
    "extra_steps": 2,
    "missing_steps": 0,
    "wrong_order": false
  },
  "annotations": [],
  "cost": {
    "tool_calls": 5,
    "turns": 6,
    "est_tokens": 2700,
    "wall_ms": 1100,
    "estimated": true
  },
  "evidence_ref": "runs/2026-07-09-run-001/raw_traces/eff-r1-102.L0.json"
}