{
  "scenario_id": "eff-r1-101",
  "fidelity": "L2",
  "adapter": "simulation",
  "ideal_path": [
    {
      "n": 0,
      "actor": "orchestrator",
      "action": "resolve-subject"
    },
    {
      "n": 1,
      "actor": "orchestrator",
      "action": "single-status"
    },
    {
      "n": 2,
      "actor": "orchestrator",
      "action": "answer"
    }
  ],
  "actual_path": [
    {
      "n": 0,
      "actor": "orchestrator",
      "action": "route",
      "output_shape": "plan"
    },
    {
      "n": 1,
      "actor": "analyst",
      "action": "tool_call",
      "output_shape": "rows"
    },
    {
      "n": 2,
      "actor": "reader",
      "action": "tool_call",
      "output_shape": "rows"
    },
    {
      "n": 3,
      "actor": "analyst",
      "action": "tool_call",
      "output_shape": "rows"
    },
    {
      "n": 4,
      "actor": "reader",
      "action": "tool_call",
      "output_shape": "rows"
    },
    {
      "n": 5,
      "actor": "reader",
      "action": "tool_call",
      "output_shape": "rows"
    },
    {
      "n": 6,
      "actor": "analyst",
      "action": "tool_call",
      "output_shape": "rows"
    },
    {
      "n": 7,
      "actor": "analyst",
      "action": "tool_call",
      "output_shape": "rows"
    },
    {
      "n": 8,
      "actor": "analyst",
      "action": "tool_call",
      "output_shape": "rows"
    },
    {
      "n": 9,
      "actor": "analyst",
      "action": "tool_call",
      "output_shape": "rows"
    },
    {
      "n": 10,
      "actor": "reader",
      "action": "tool_call",
      "output_shape": "rows"
    },
    {
      "n": 11,
      "actor": "reader",
      "action": "tool_call",
      "output_shape": "rows"
    },
    {
      "n": 12,
      "actor": "reader",
      "action": "tool_call",
      "output_shape": "rows"
    },
    {
      "n": 13,
      "actor": "analyst",
      "action": "tool_call",
      "output_shape": "rows"
    },
    {
      "n": 14,
      "actor": "analyst",
      "action": "tool_call",
      "output_shape": "rows"
    }
  ],
  "final_answer": "Predicted answer for eff-r1-101",
  "divergence": {
    "summary": "unnecessary-call, duplicate-work, retry-loop",
    "extra_steps": 11,
    "missing_steps": 0,
    "wrong_order": false
  },
  "annotations": [
    "unnecessary-call",
    "duplicate-work",
    "retry-loop"
  ],
  "cost": {
    "tool_calls": 14,
    "turns": 15,
    "est_tokens": 5400,
    "wall_ms": 2180,
    "estimated": false
  },
  "evidence_ref": "runs/2026-07-09-run-001/raw_traces/eff-r1-101.L2.json"
}