{
  "scenario_id": "sta-r1-100",
  "fidelity": "L0",
  "adapter": "simulation",
  "ideal_path": [
    {
      "n": 0,
      "actor": "orchestrator",
      "action": "plan"
    },
    {
      "n": 1,
      "actor": "orchestrator",
      "action": "iterate"
    },
    {
      "n": 2,
      "actor": "orchestrator",
      "action": "terminate"
    }
  ],
  "actual_path": [
    {
      "n": 0,
      "actor": "orchestrator",
      "action": "route",
      "output_shape": "plan"
    },
    {
      "n": 1,
      "actor": "analyst",
      "action": "tool_call",
      "output_shape": "rows"
    },
    {
      "n": 2,
      "actor": "reader",
      "action": "tool_call",
      "output_shape": "rows"
    },
    {
      "n": 3,
      "actor": "analyst",
      "action": "tool_call",
      "output_shape": "rows"
    },
    {
      "n": 4,
      "actor": "analyst",
      "action": "tool_call",
      "output_shape": "rows"
    },
    {
      "n": 5,
      "actor": "analyst",
      "action": "tool_call",
      "output_shape": "rows"
    },
    {
      "n": 6,
      "actor": "reader",
      "action": "tool_call",
      "output_shape": "rows"
    },
    {
      "n": 7,
      "actor": "analyst",
      "action": "tool_call",
      "output_shape": "rows"
    },
    {
      "n": 8,
      "actor": "analyst",
      "action": "tool_call",
      "output_shape": "rows"
    },
    {
      "n": 9,
      "actor": "analyst",
      "action": "tool_call",
      "output_shape": "rows"
    }
  ],
  "final_answer": "Predicted answer for sta-r1-100",
  "divergence": {
    "summary": "retry-loop",
    "extra_steps": 6,
    "missing_steps": 0,
    "wrong_order": false
  },
  "annotations": [
    "retry-loop"
  ],
  "cost": {
    "tool_calls": 9,
    "turns": 10,
    "est_tokens": 3900,
    "wall_ms": 1580,
    "estimated": true
  },
  "evidence_ref": "runs/2026-07-09-run-001/raw_traces/sta-r1-100.L0.json"
}